{
  "schema_version": "1.0",
  "id": "20000000-0000-4000-8000-000000000011",
  "tenant_id": "10000000-0000-4000-8000-000000000001",
  "channel_connection_id": "20000000-0000-4000-8000-000000000001",
  "external_event_id": "webhook-event-synthetic-001",
  "processing_status": "received",
  "received_at": "2026-07-12T08:05:00.000Z",
  "processed_at": null,
  "adapter_metadata": {
    "event_type": "messages"
  }
}
